{
  "schemaVersion": 1,
  "slug": "logo-v-splash-redesign",
  "title": "Logo V and Splash Redesign",
  "lifecycle": "archived",
  "startedAt": "2026-07-18",
  "archivedAt": "2026-07-18",
  "summary": "重建品牌 V mark，並統一 iOS 與 Android PWA splash 的幾何、背景與 icon 產製流程。",
  "capabilities": [
    "platform/design-system/brand",
    "platform/pwa/splash-screen"
  ],
  "tags": ["branding", "pwa", "assets"]
}
