{
  "schemaVersion": 1,
  "slug": "unified-software-delivery-workflow",
  "title": "Unified Software Delivery Workflow",
  "lifecycle": "archived",
  "startedAt": "2026-07-31",
  "archivedAt": "2026-08-06",
  "summary": "以 repo-native lifecycle 統一 Manual 與 Symphony execution，並以 Blueprint 保存 durable delivery knowledge。",
  "capabilities": [
    "platform/blueprint",
    "platform/agent-orchestration",
    "platform/delivery-workflow"
  ],
  "tags": ["workflow", "orchestration", "knowledge-management"]
}
